{
  "$schema": "../../.schema/v1/enum.json",
  "kind": "enum",
  "id": "01JQENM0000000000000000001",
  "name": "SalesOrderStatus",
  "package": "01JQPKG0000000000000000001",
  "members": [
    {
      "id": "01JQMEM0000000000000000001",
      "name": "Draft"
    },
    {
      "id": "01JQMEM0000000000000000002",
      "name": "CreditReview"
    },
    {
      "id": "01JQMEM0000000000000000003",
      "name": "Fulfilment"
    },
    {
      "id": "01JQMEM0000000000000000004",
      "name": "OnHold"
    },
    {
      "id": "01JQMEM0000000000000000005",
      "name": "Completed"
    },
    {
      "id": "01JQMEM0000000000000000006",
      "name": "Cancelled"
    }
  ]
}
